{"schema":"work-package.v1","packageId":"01J9ZZZZZZZZZZZZZZZZZZZZZ1","issuer":{"kind":"123","id":"api.123.do"},"issuedAt":"2026-09-05T10:00:00Z","correlation":{"refs":[{"kind":"action","id":"42"},{"kind":"step","id":"17"}]},"agent":{"id":"example.test/helper","version":"1.2.0","digest":"sha256:f0c320a539ac10d7fd236f60f1d34ee8b0f6ee9aabdc865c8a2610fb6a3c6980"},"placement":"client","workspace":{"kind":"git","path":"/home/me/repo","ownership":"caller"},"objective":"add a function","completion":{"conditions":["the function exists","its test passes"],"expectedEvidence":["a passing test"],"landing":"commit"},"capabilities":{"granted":["repo.read","repo.write","shell.run"],"limits":{"maxUsd":5,"maxTurns":40,"timeout":"30m","network":"open"}},"authority":{"may":[{"capability":"edit","scope":"src/ only"}],"mayNot":["touch prod"],"approvalRequired":["deploy"]}}
