{"schema":"work-package.v1","packageId":"01J9ZZZZZZZZZZZZZZZZZZZZZ2","issuer":{"kind":"123","id":"api.123.do"},"issuedAt":"2026-09-05T10:00:00Z","agent":{"id":"example.test/helper"},"placement":"client","workspace":{"kind":"none","ownership":"caller"},"objective":"approved-send: the quote","completion":{"conditions":["the email was sent"],"landing":"none"},"capabilities":{"granted":[],"limits":{}},"approval":{"proposalRef":"entry:9","approvalRef":"reaction:3","approvedBy":"user:7","action":"send_email","target":"supplier@example.test","params":{"subject":"Quote request","to":"supplier@example.test"},"paramsHash":"sha256:dba9e2c91e5a127154dc6f8c933274dd4697610c4fa8cb8615f0cfd0d63d484b"}}
